{
  "$schema": "./v5.schema.json",
  "artifact_id": "keel.permit.presentation_registry",
  "version": "keel.presentation_registry.v5",
  "semantic_registry_version": "keel.semantic_selector_registry.v6",
  "allowed_leading_fields": [
    "declared_purpose",
    "job_reference",
    "resource",
    "amount",
    "currency",
    "recipient",
    "provider",
    "model",
    "request_digest",
    "session_id",
    "linked_to"
  ],
  "allowed_evidence_sections": [
    "record_identity",
    "authorization",
    "approval",
    "relationship",
    "limits",
    "dispatch",
    "provider_outcome",
    "authority_lifecycle",
    "value_conservation",
    "settlement",
    "evidence_scope"
  ],
  "human_artifact_contract": {
    "artifact_schema": "schemas/permit-human-artifact-v1.schema.json",
    "package_manifest_schema": "schemas/permit-package-manifest-v1.schema.json",
    "default_view": "human",
    "title_source": "verified_semantic_profile",
    "state_titles": {
      "denial": "AI Action Denied",
      "review": "AI Action Awaiting Approval"
    },
    "status_labels": {
      "authorized": "Authorized, not dispatched",
      "dispatched": "Dispatched, provider outcome pending",
      "provider_accepted": "Provider accepted",
      "provider_completed": "Provider reported completion",
      "provider_rejected": "Provider rejected",
      "outcome_unknown": "External outcome unknown",
      "expired_unused": "Expired unused",
      "revoked": "Revoked",
      "denied": "Denied before dispatch",
      "awaiting_approval": "No dispatch before approval"
    },
    "summary": {
      "position": "end",
      "derivation": "verifier_from_verified_fields",
      "template": "semantics/permit/human_summary_v1.json",
      "required_inputs": [
        "artifact_kind",
        "agent",
        "action",
        "target",
        "issued_at",
        "expires_at",
        "dispatch_state",
        "provider_state",
        "provider_object_id",
        "integrity_verdict",
        "trust_mode"
      ],
      "missing_value_rule": "omit_never_invent"
    },
    "lifecycle_fields": {
      "required": [
        "issued_at",
        "expires_at",
        "status"
      ],
      "optional": [
        "expiry_limiting_source",
        "dispatched_at",
        "first_used_at",
        "last_used_at",
        "use_count",
        "max_uses",
        "revoked_at",
        "verified_at"
      ]
    },
    "advanced_representations": [
      "signed_evidence_json",
      "canonical_signed_bytes",
      "canonical_signed_bytes_hex",
      "canonical_signed_bytes_base64",
      "signatures",
      "digests",
      "contract_pins"
    ],
    "package_trust_rule": "verify_signed_evidence_and_regenerate_human_view"
  },
  "profiles": [
    {
      "semantic_id": "keel.context.work.v1",
      "presentation_profile_id": "permit_to_work.r1",
      "customer_title": "AI Permit-to-Work",
      "type_definition": "Authorization for one bounded AI job",
      "leading_fields": [
        {
          "field": "declared_purpose",
          "label": "Declared purpose"
        },
        {
          "field": "job_reference",
          "label": "Job reference"
        },
        {
          "field": "resource",
          "label": "Resource"
        }
      ],
      "evidence_sections": [
        "record_identity",
        "authorization",
        "approval",
        "relationship",
        "limits",
        "authority_lifecycle",
        "value_conservation",
        "evidence_scope"
      ],
      "does_not_establish": [
        "business_job_completion",
        "provider_success",
        "financial_settlement",
        "comprehensive_runtime_recording"
      ],
      "fallback_profile": "generic_ai_permit",
      "release_state": "eligible"
    },
    {
      "semantic_id": "keel.action.payment_execute.v1",
      "presentation_profile_id": "permit_to_pay.r1",
      "customer_title": "AI Permit-to-Pay",
      "type_definition": "Exact payment authorization",
      "leading_fields": [
        {
          "field": "amount",
          "label": "Amount"
        },
        {
          "field": "currency",
          "label": "Currency"
        },
        {
          "field": "recipient",
          "label": "Recipient"
        },
        {
          "field": "linked_to",
          "label": "Linked to"
        }
      ],
      "evidence_sections": [
        "record_identity",
        "authorization",
        "approval",
        "relationship",
        "limits",
        "dispatch",
        "provider_outcome",
        "settlement"
      ],
      "does_not_establish": [
        "provider_success",
        "financial_settlement"
      ],
      "fallback_profile": "generic_ai_permit",
      "release_state": "eligible"
    },
    {
      "semantic_id": "keel.action.generate_text.v1",
      "presentation_profile_id": "permit_to_generate_text.r2",
      "customer_title": "AI Permit-to-Generate Text",
      "type_definition": "Exact text-generation authorization through a certified adapter",
      "leading_fields": [
        {
          "field": "provider",
          "label": "Provider"
        },
        {
          "field": "model",
          "label": "Model"
        },
        {
          "field": "request_digest",
          "label": "Request"
        },
        {
          "field": "linked_to",
          "label": "Linked to"
        }
      ],
      "evidence_sections": [
        "record_identity",
        "authorization",
        "relationship",
        "limits",
        "dispatch",
        "provider_outcome"
      ],
      "does_not_establish": [
        "provider_success",
        "content_truth_or_quality"
      ],
      "fallback_profile": "generic_ai_permit",
      "release_state": "eligible"
    },
    {
      "semantic_id": "keel.action.payment_refund.v1",
      "presentation_profile_id": "permit_to_refund_payment.r1",
      "customer_title": "AI Permit-to-Refund-Payment",
      "type_definition": "Exact bounded payment-refund authorization",
      "leading_fields": [
        {
          "field": "amount",
          "label": "Maximum amount"
        },
        {
          "field": "currency",
          "label": "Currency"
        },
        {
          "field": "recipient",
          "label": "Payer"
        },
        {
          "field": "linked_to",
          "label": "Original payment"
        }
      ],
      "evidence_sections": [
        "record_identity",
        "authorization",
        "approval",
        "relationship",
        "limits",
        "dispatch",
        "provider_outcome"
      ],
      "does_not_establish": [
        "processor_acceptance",
        "funds_returned",
        "financial_settlement"
      ],
      "fallback_profile": "generic_ai_permit",
      "release_state": "eligible"
    },
    {
      "semantic_id": "keel.action.agent_delegate.v1",
      "presentation_profile_id": "permit_to_delegate.r1",
      "customer_title": "AI Permit-to-Delegate",
      "type_definition": "Exact bounded delegation authorization",
      "leading_fields": [
        {
          "field": "resource",
          "label": "Intended child"
        },
        {
          "field": "declared_purpose",
          "label": "Purpose"
        },
        {
          "field": "linked_to",
          "label": "Parent authority"
        }
      ],
      "evidence_sections": [
        "record_identity",
        "authorization",
        "approval",
        "relationship",
        "limits",
        "authority_lifecycle",
        "evidence_scope"
      ],
      "does_not_establish": [
        "general_agent_identity_registration",
        "independent_human_identity",
        "activity outside delegated scope"
      ],
      "fallback_profile": "generic_ai_permit",
      "release_state": "eligible"
    },
    {
      "semantic_id": "keel.context.realtime_session.v1",
      "presentation_profile_id": "realtime_session.r1",
      "customer_title": "AI Permit — Realtime session",
      "type_definition": "Bounded realtime session authority",
      "leading_fields": [
        {
          "field": "session_id",
          "label": "Session"
        },
        {
          "field": "provider",
          "label": "Provider"
        },
        {
          "field": "model",
          "label": "Model"
        }
      ],
      "evidence_sections": [
        "record_identity",
        "authorization",
        "limits",
        "dispatch",
        "provider_outcome",
        "evidence_scope"
      ],
      "does_not_establish": [
        "participant_identity",
        "recording_consent",
        "authority_to_represent",
        "business_job_completion",
        "comprehensive_runtime_recording"
      ],
      "fallback_profile": "generic_ai_permit",
      "release_state": "generic_qualified"
    },
    {
      "semantic_id": "keel.action.database_rows_insert.v1",
      "presentation_profile_id": "database_rows_insert.r1",
      "customer_title": "AI Permit-to-Insert-Database-Rows",
      "type_definition": "Exact authorization to insert bounded rows into one database table",
      "leading_fields": [
        {
          "field": "resource",
          "label": "Table"
        },
        {
          "field": "request_digest",
          "label": "Rows"
        },
        {
          "field": "provider",
          "label": "Database gateway"
        }
      ],
      "evidence_sections": [
        "record_identity",
        "authorization",
        "approval",
        "limits",
        "dispatch",
        "provider_outcome",
        "evidence_scope"
      ],
      "does_not_establish": [
        "database_commit_without_provider_receipt",
        "effects_outside_the_bound_table",
        "business_validity_of_inserted_data"
      ],
      "fallback_profile": "generic_ai_permit",
      "release_state": "eligible"
    },
    {
      "semantic_id": "keel.action.database_rows_update.v1",
      "presentation_profile_id": "database_rows_update.r1",